{
  "$schema": "https://json-schema.org/draft/2020-12/schema",
  "$id": "https://exoper.dev/schemas/broker-catalog/brand.schema.json",
  "title": "Exoper Broker Catalog — Brand Record",
  "description": "Authoritative contract for a single broker brand file under infrastructure/broker-catalog/<brand_id>.json. One file per brand. Validated fail-closed by src/engine/ta/broker/registry.py at engine boot. See MT5_Multi_Broker_Provisioning_Architecture.md §5.2.",
  "type": "object",
  "additionalProperties": false,
  "required": [
    "brand_id",
    "display_name",
    "official_website",
    "mt5_supported",
    "mt4_supported",
    "installer_packaging",
    "status"
  ],
  "properties": {
    "brand_id": {
      "type": "string",
      "description": "Lowercase, underscore-separated brand identifier. Must match the filename stem.",
      "pattern": "^[a-z0-9]+(_[a-z0-9]+)*$",
      "minLength": 2,
      "maxLength": 64
    },
    "display_name": {
      "type": "string",
      "description": "Brand name exactly as the broker presents it.",
      "minLength": 1,
      "maxLength": 100
    },
    "official_website": {
      "type": "string",
      "description": "The broker's own official website (https).",
      "format": "uri",
      "pattern": "^https://"
    },
    "mt5_supported": {
      "type": "boolean",
      "description": "Whether this broker offers an MT5 terminal at all."
    },
    "mt4_supported": {
      "type": "boolean",
      "description": "Whether this broker offers an MT4 terminal at all."
    },
    "installer_packaging": {
      "type": "string",
      "description": "How the broker packages its MT5 installer. 'none' for brands that do not offer MT5.",
      "enum": ["unified", "per_entity", "none", "unknown"]
    },
    "status": {
      "type": "string",
      "description": "Lifecycle state. 'active' is only permitted after the verification gate passes and the bundle + sha are published to R2 (see conditional rules below).",
      "enum": ["active", "pending_bake", "unsupported_mt5", "inactive"]
    },
    "notes": {
      "type": "string",
      "description": "Free-text operator context (packaging observations, regional restrictions, why a brand is unsupported, etc.)."
    },
    "entities": {
      "type": "array",
      "description": "Legal entities under this brand that offer MT5. Empty iff mt5_supported is false.",
      "items": { "$ref": "#/$defs/entity" }
    }
  },
  "allOf": [
    {
      "description": "A brand that supports neither MT5 nor MT4 must carry no entities.",
      "if": { 
        "properties": { 
          "mt5_supported": { "const": false },
          "mt4_supported": { "const": false }
        } 
      },
      "then": { "properties": { "entities": { "maxItems": 0 } } }
    },
    {
      "description": "A brand that supports either MT5 or MT4 must carry at least one entity.",
      "if": { 
        "anyOf": [
          { "properties": { "mt5_supported": { "const": true } } },
          { "properties": { "mt4_supported": { "const": true } } }
        ]
      },
      "then": { "properties": { "entities": { "minItems": 1 } } }
    },
    {
      "description": "An active brand must have every entity fully provisioned (at least one platform present, and any present platform must have R2 bundle + sha + non-empty live servers). Enforced in the loader; expressed here for documentation.",
      "if": { "properties": { "status": { "const": "active" } } },
      "then": {
        "properties": {
          "entities": {
            "minItems": 1,
            "items": {
              "required": [
                "entity_id",
                "display_name",
                "platforms"
              ]
            }
          }
        }
      }
    }
  ],
  "$defs": {
    "entity": {
      "type": "object",
      "additionalProperties": false,
      "required": ["entity_id", "display_name"],
      "properties": {
        "entity_id": {
          "type": "string",
          "description": "Brand-prefixed, lowercase, underscore-separated entity identifier (e.g. exness_technologies_ltd).",
          "pattern": "^[a-z0-9]+(_[a-z0-9]+)*$",
          "minLength": 2,
          "maxLength": 96
        },
        "display_name": {
          "type": "string",
          "description": "Entity's full legal name exactly as the broker publishes it.",
          "minLength": 1,
          "maxLength": 120
        },
        "regulator": {
          "type": "string",
          "description": "Short-form regulator name for display (e.g. 'FSA Seychelles', 'CySEC'). Advisory only.",
          "maxLength": 80
        },
        "platforms": {
          "type": "object",
          "description": "Platform-specific provisioning data (MT4, MT5).",
          "additionalProperties": false,
          "properties": {
            "mt4": { "$ref": "#/$defs/platform_config" },
            "mt5": { "$ref": "#/$defs/platform_config" }
          }
        }
      }
    },
    "platform_config": {
      "type": "object",
      "additionalProperties": false,
      "required": ["bundle_r2_path", "bundle_sha256", "servers"],
      "properties": {
        "acquisition_url": {
          "type": "string",
          "description": "ACQUISITION ONLY — the broker's own official installer URL used ONCE BY A HUMAN on the bake workstation. This is NEVER a runtime/pipeline fetch path; the CI build guard blocks download.mql5.com as a build arg. The system fetch path is bundle_r2_path.",
          "format": "uri",
          "pattern": "^https://"
        },
        "bundle_r2_path": {
          "type": "string",
          "description": "SYSTEM FETCH PATH — the only path the provisioner/initContainer pulls from. The baked, sha-pinned per-broker portable zip in R2.",
          "minLength": 1,
          "maxLength": 512
        },
        "bundle_sha256": {
          "type": "string",
          "description": "SHA256 of the baked portable zip referenced by bundle_r2_path. 64 lowercase hex chars.",
          "pattern": "^[0-9a-f]{64}$"
        },
        "verified_on": {
          "type": "string",
          "description": "ISO date (YYYY-MM-DD) the verification gate passed for this entity's bundle.",
          "pattern": "^[0-9]{4}-[0-9]{2}-[0-9]{2}$"
        },
        "servers": {
          "type": "object",
          "additionalProperties": false,
          "description": "Exact server strings extracted from the baked config files (verbatim, every numbered variant). NEVER researched as free text.",
          "required": ["live"],
          "properties": {
            "demo": {
              "type": "array",
              "items": { "type": "string", "minLength": 1, "maxLength": 120 },
              "uniqueItems": true
            },
            "live": {
              "type": "array",
              "items": { "type": "string", "minLength": 1, "maxLength": 120 },
              "uniqueItems": true
            }
          }
        }
      }
    }
  }
}
