{
  "brand_id": "exness",
  "display_name": "Exness",
  "official_website": "https://www.exness.com",
  "mt5_supported": true,
  "mt4_supported": true,
  "installer_packaging": "per_entity",
  "status": "active",
  "entities": [
    {
      "entity_id": "exness_technologies_ltd",
      "display_name": "Exness Technologies Ltd",
      "regulator": "unknown",
      "platforms": {
        "mt5": {
          "acquisition_url": "https://download.mql5.com/cdn/web/exness.technologies.ltd/mt5/exness5setup.exe",
          "bundle_r2_path": "r2://etradie-installers/broker-bundles/exness-portable.zip",
          "bundle_sha256": "eadee9c7a152514f9c904b381a9416cf3d88dc5e480a12a62544079743c5e11c",
          "verified_on": "2026-06-22",
          "servers": {
            "demo": [
              "Exness-MT5Trial10",
              "Exness-MT5Trial11",
              "Exness-MT5Trial12",
              "Exness-MT5Trial14",
              "Exness-MT5Trial15",
              "Exness-MT5Trial16",
              "Exness-MT5Trial17",
              "Exness-MT5Trial2",
              "Exness-MT5Trial3",
              "Exness-MT5Trial4",
              "Exness-MT5Trial5",
              "Exness-MT5Trial6",
              "Exness-MT5Trial7",
              "Exness-MT5Trial8",
              "Exness-MT5Trial9"
            ],
            "live": [
              "Exness-MT5Real",
              "Exness-MT5Real10",
              "Exness-MT5Real11",
              "Exness-MT5Real12",
              "Exness-MT5Real14",
              "Exness-MT5Real15",
              "Exness-MT5Real16",
              "Exness-MT5Real17",
              "Exness-MT5Real18",
              "Exness-MT5Real19",
              "Exness-MT5Real2",
              "Exness-MT5Real20",
              "Exness-MT5Real21",
              "Exness-MT5Real22",
              "Exness-MT5Real23",
              "Exness-MT5Real24",
              "Exness-MT5Real25",
              "Exness-MT5Real26",
              "Exness-MT5Real27",
              "Exness-MT5Real28",
              "Exness-MT5Real29",
              "Exness-MT5Real3",
              "Exness-MT5Real30",
              "Exness-MT5Real31",
              "Exness-MT5Real32",
              "Exness-MT5Real33",
              "Exness-MT5Real34",
              "Exness-MT5Real35",
              "Exness-MT5Real36",
              "Exness-MT5Real37",
              "Exness-MT5Real38",
              "Exness-MT5Real39",
              "Exness-MT5Real4",
              "Exness-MT5Real40",
              "Exness-MT5Real41",
              "Exness-MT5Real42",
              "Exness-MT5Real43",
              "Exness-MT5Real46",
              "Exness-MT5Real5",
              "Exness-MT5Real6",
              "Exness-MT5Real7",
              "Exness-MT5Real8",
              "Exness-MT5Real9"
            ]
          }
        },
        "mt4": {
          "acquisition_url": "https://download.mql5.com/cdn/web/exness.technologies.ltd/mt4/exness4setup.exe",
          "bundle_r2_path": "r2://etradie-installers/broker-bundles/exness-mt4-portable.zip",
          "bundle_sha256": "790101cf0039eb9a4805f71cbb77293aa46de978e8ef33e9c5eca34c20dfa09c",
          "verified_on": "2026-06-22",
          "servers": {
            "demo": [
              "Exness-Trial10",
              "Exness-Trial11",
              "Exness-Trial12",
              "Exness-Trial14",
              "Exness-Trial15",
              "Exness-Trial16",
              "Exness-Trial2",
              "Exness-Trial4",
              "Exness-Trial5",
              "Exness-Trial6",
              "Exness-Trial7",
              "Exness-Trial8",
              "Exness-Trial9"
            ],
            "live": [
              "Exness-Real",
              "Exness-Real11",
              "Exness-Real12",
              "Exness-Real14",
              "Exness-Real15",
              "Exness-Real16",
              "Exness-Real17",
              "Exness-Real18",
              "Exness-Real19",
              "Exness-Real2",
              "Exness-Real20",
              "Exness-Real22",
              "Exness-Real23",
              "Exness-Real24",
              "Exness-Real26",
              "Exness-Real27",
              "Exness-Real28",
              "Exness-Real29",
              "Exness-Real3",
              "Exness-Real30",
              "Exness-Real31",
              "Exness-Real32",
              "Exness-Real33",
              "Exness-Real34",
              "Exness-Real35",
              "Exness-Real36",
              "Exness-Real37",
              "Exness-Real38",
              "Exness-Real39",
              "Exness-Real4",
              "Exness-Real40",
              "Exness-Real41",
              "Exness-Real6",
              "Exness-Real7",
              "Exness-Real8",
              "Exness-Real9"
            ]
          }
        }
      }
    }
  ]
}
